### ISSUE TITLE
 opx-switch-shell "l3 def ip show" on openswitch V.2.3.x

### ISSUE THREAD

**Issue by dj-s** [open-switch/opx-nas-daemon#27]
Hello,

this question/issue concerned Openswitch version 2.3.0 and 2.3.1 on DELL-S3048 plateform.  

Since OPX version 2.3.x. ` opx-switch-shell "l3 def ip show"` does not show my loopback IP address

in fact, with tcpdump, opx-2.3.x does not handle ping response.

A : my local IP : 10.32.0.4
B : remote  IP : 10.32.0.1

   - tcpdump on UPLINK  A :

        A ping B -> Echo (no reply)
        B ping A -> Nothing

   - tcpdump on UPLINK B :

        A ping B -> Echo + reply
        B ping A -> Echo (no reply)

    root@opx230:~$ opx-show-version
    OS_NAME="OPX"
    OS_VERSION="2.3.0"
    PLATFORM="S3048-ON"
    ARCHITECTURE="x86_64"
    INTERNAL_BUILD_ID="OpenSwitch blueprint for Dell 1.0.0"
    BUILD_VERSION="2.3.0.0"
    BUILD_DATE="2018-03-27T20:07:19-0700"
    INSTALL_DATE="2018-06-08T15:26:32+0000"
    SYSTEM_UPTIME= 3 days, 16 hours, 15 minutes
    SYSTEM_STATE= running
    UPGRADED_PACKAGES=no
    ALTERED_PACKAGES=no

    admin@opx230:~$ ip add
    1: lo: <LOOPBACK,UP,LOWER_UP> mtu 65536 qdisc noqueue state UNKNOWN group default 
    link/loopback 00:00:00:00:00:00 brd 00:00:00:00:00:00
    inet 127.0.0.1/8 scope host lo
       valid_lft forever preferred_lft forever
    inet 10.32.0.4/32 scope global lo
       valid_lft forever preferred_lft forever
    inet6 ::1/128 scope host 
       valid_lft forever preferred_lft forever

    root@opx230:~# opx-switch-shell "l3 defip show"
    Unit 0, Total Number of DEFIP entries: 16384
    VRF Net addr Next Hop Mac INTF MODID PORT PRIO CLASS HIT VLAN
    2048 0 32.0.0.1/32 00:00:00:00:00:00 100002 0 0 0 0 n 
    2048 0 32.0.0.33/32 00:00:00:00:00:00 100002 0 0 0 0 n 
    2049 0 10.32.0.1/32 00:00:00:00:00:00 100004 0 0 0 0 n 
    3072 0 32.0.0.0/29 00:00:00:00:00:00 100002 0 0 0 0 n 
    3072 0 32.0.0.32/29 00:00:00:00:00:00 100002 0 0 0 0 n

    root@opx230:~# opx-switch-shell "l3 egress show"
    Unit 0, Total Number of DEFIP entries: 16384
    Entry  Mac                 Vlan INTF PORT MOD MPLS_LABEL ToCpu Drop RefCount L3MC
    100002  00:00:00:00:00:00 4095    0     0    0        -1   no   no    5   no
    100003  00:00:00:00:00:00 4095    0     0    0        -1   no  yes    1   no
    100004  14:18:77:87:cd:c7 4095    3    52    0        -1   no   no    2   no

there is no problem with version 2.2.0 and 2.2.1.

thank for your support

**Comment by nchervela** [comment]
@dj-s You will need to create a dummy interface for this. 

root@OPX:~# ip link add name loop2 type dummy
root@OPX:~# ifconfig loop2 10.10.1.1 netmask 255.255.255.0

root@OPX:~# opx-switch-shell "l3 defip show"
Unit 0, Total Number of DEFIP entries: 16384
#     VRF     Net addr             Next Hop Mac        INTF MODID PORT PRIO CLASS HIT VLAN
1024  0        10.10.1.1/32         00:00:00:00:00:00 100002    0     0     0    0 n
1536  0        10.10.1.0/24         00:00:00:00:00:00 100002    0     0     0    0 n

root@OPX:~# opx-show-version
OS_NAME="OPX"
OS_VERSION="2.3.1"
PLATFORM="S6000-ON"
ARCHITECTURE="x86_64"
INTERNAL_BUILD_ID="OpenSwitch blueprint for Dell 1.0.0"
BUILD_VERSION="2.3.1.0"
BUILD_DATE="2018-05-15T20:25:40+0000"
INSTALL_DATE="2018-06-01T01:24:29+0000"
SYSTEM_UPTIME= 4 days, 10 hours, 56 minutes
SYSTEM_STATE= running

**Comment by jeff-yin** [comment]
@dj-s Does that work for you? Let us know if the question can be closed.

**Comment by nchervela** [comment]
To elaborate on my previous comment, 127.x.y.z/8 interface is the kernel-internal loopback interface, and NPU is not made aware of this.  Hence, you don't see it in "l3 defip show".  As mentioned in the example in the previous comment, pls create a dummy interface, and assign an ip address that is outside of the 127.x.y.z range.  You will then see it in "l3 defip show".

**Comment by dj-s** [comment]
@nchervela @jeff-yin 

thank you for your responses and sorry for my delay. i test many things, and i still have problem to ping a remote ip with a loopback inteface . i will prepare some technical facts within 2 day.

**Comment by dj-s** [comment]
hi,

I followed your advice about dummy interface. 

`root@opx230:~#ip link add name dummy1 type dummy`
`root@opx230:~#ifconfig dummy1 10.32.0.4/32`
`root@opx230:~#ifconfig dummy1 up`

`root@opx230:~# opx-switch-shell "l3 defip show`
`Unit 0, Total Number of DEFIP entries: 16384`
`"#     VRF     Net addr             Next Hop Mac        INTF MODID PORT PRIO CLASS HIT VLAN"`
`2048  0        10.32.0.4/32         00:00:00:00:00:00 100002    0     0     0    0 n`
`2048  0        32.0.0.1/32          00:00:00:00:00:00 100002    0     0     0    0 n`
`2049  0        32.0.0.33/32         00:00:00:00:00:00 100002    0     0     0    0 n`
`2049  0        10.32.0.1/32         00:00:00:00:00:00 100004    0     0     0    0 n`
`3072  0        32.0.0.0/29          00:00:00:00:00:00 100002    0     0     0    0 n`
`3072  0        32.0.0.32/29         00:00:00:00:00:00 100002    0     0     0    0 n`

and ping my remote switch

`root@opx220-remote:~# tcpdump -i e101-001-0 proto ICMP`
`tcpdump: verbose output suppressed, use -v or -vv for full protocol decode  `                                                                                                                                                                 
`listening on e101-001-0, link-type EN10MB (Ethernet), capture size 262144 bytes  `                                                                                                                                                            
`19:33:24.794801 IP 172.16.3.99 > 10.32.0.1: ICMP echo request, id 1857, seq 13, length 64`   
[..]

ping does'nt work because my source IP is "management IP eth0, 172.16.3.99" and not my "dummy ip 10.32.0.4".

Ping source with dummy1 does'nt work.


a solution with iptable.

``root@opx230:~#iptables -t nat -A POSTROUTING -s 0.0.0.0/0 -d 10.32.0.0/16 -j SNAT --to-source 10.32.0.4``

``root@opx230:~#iptables -t nat -L``
``[...]``
``Chain POSTROUTING (policy ACCEPT)``
``target     prot opt source               destination    ``     
``SNAT       all  --  anywhere             10.32.0.0/16         to:10.32.0.4``

iptables rule is OK

``root@opx230:~# ping 10.32.0.1``
``PING 10.32.0.1 (10.32.0.1) 56(84) bytes of data.``
``64 bytes from 10.32.0.1: icmp_seq=1 ttl=64 time=0.499 ms``
``64 bytes from 10.32.0.1: icmp_seq=2 ttl=64 time=0.512 ms``
``64 bytes from 10.32.0.1: icmp_seq=3 ttl=64 time=0.491 ms``
``64 bytes from 10.32.0.1: icmp_seq=4 ttl=64 time=0.497 ms``

remote switch

``root@opx220-remote:~# tcpdump -i e101-001-0 proto ICMP``
``tcpdump: verbose output suppressed, use -v or -vv for full protocol decode``
``listening on e101-001-0, link-type EN10MB (Ethernet), capture size 262144 bytes``
``16:48:37.218717 IP 10.32.0.4 > 10.32.0.1: ICMP echo request, id 1862, seq 1, length 64``
``16:48:37.218755 IP 10.32.0.1 > 10.32.0.4: ICMP echo reply, id 1862, seq 1, length 64``

now ping is OK !


Questions : 

is it possible to use a dummy Iface without iptables rules (NAT) ?


i have to test others things before post problems/questions about :

1) persistent dummy in /etc/network/interfaces.d
2) ``opx-switch-shell "l3 defip show`"` result change with id 1024or2048 to 1025or2049  with my dummy

where can i post these futur questions ? 


thanks a lot for your time !

**Comment by nchervela** [comment]
@dj-s can you please describe your setup, with a diagram if possible? Also, can you share details of "IP route show", and interface configurations.

**Comment by nchervela** [comment]
And "arp -n" output too, pls

**Comment by dj-s** [comment]
@nchervela ,

i prepared this plan yesterday without "arp -n" outpout.

![opx-issue](https://user-images.githubusercontent.com/37775156/42724302-f5594b34-876f-11e8-92ae-109b23f8e4c6.png)

**Comment by nchervela** [comment]
@dj-s thanks...will look into it.

**Comment by nchervela** [comment]
@dj-s Have you tried the steps in the comment above?  If no further questions, I'd like to close this ticket.  Turns out that FRR needs the interface name to start with "lo", and ping needs the source address (and not just interface name) to be specified.

**Comment by dj-s** [comment]
@nchervela ,

thank you for your response, i can't test this workaround now, i'll do it as soon as possible.

ok, to close this issue

**Comment by nchervela** [comment]
@dj-s  welcome!
